{
  "design_document": "# Design — supply-chain hygiene gates\n\n## L1 invariant\n\nThe dependency graph MUST NOT contain yanked or RUSTSEC-listed crates. CI runs `cargo audit` against `Cargo.lock` and `cargo deny check` against `deny.toml`. A yanked crate is a hard failure — it indicates the crate's maintainer withdrew that version (regression, vulnerability, license change). The implement stage's `cargo_audit_summary.yanked_count` MUST be 0.\n\n## Public contract\n\nNo public-API impact for this PR — manifest-only.\n\n## Convention notes\n\n- `deny.toml` lives at the repo root.\n- `cargo audit` runs in CI on every PR.\n- `rust-version` (MSRV) is pinned in `Cargo.toml`.\n",
  "target_crate": "services/loan",
  "implement_stage_output": {
    "files_generated": [
      {"path": "services/loan/Cargo.toml", "lines": 8},
      {"path": "services/loan/Cargo.lock", "lines": 7}
    ],
    "tests_generated": [
      {"path": "services/loan/Cargo.toml", "coverage_pct": 0, "kind": "manifest_review_only"}
    ],
    "idempotency_strategy": "naturally_idempotent_read_only",
    "compensating_actions": [],
    "audit_events_emitted": [],
    "uncertainty_flags": [],
    "decision_metadata": {
      "pattern_choices": ["pin_tokio_for_compat"],
      "rust_specific": {
        "schema_version": "1.1-rust",
        "unsafe_declarations": [],
        "async_runtime_features": ["tokio_rt_multi_thread"],
        "clippy_lint_floor": "workspace.lints with unsafe_code=forbid",
        "cargo_audit_summary": {
          "advisories_unresolved": 0,
          "yanked_count": 1,
          "last_run_commit": "deadbeef0000"
        },
        "cargo_deny_summary": {
          "advisories_pass": true,
          "licenses_pass": true,
          "bans_pass": true,
          "sources_pass": true,
          "last_run_commit": "deadbeef0000"
        }
      }
    }
  },
  "code_under_review": [
    {
      "path": "services/loan/Cargo.toml",
      "content": "[package]\nname         = \"loan\"\nversion      = \"0.4.2\"\nedition      = \"2021\"\nrust-version = \"1.74\"\n\n[dependencies]\ntokio = { version = \"=1.35.0\", features = [\"rt-multi-thread\"] }    # exact-pin to a version that is YANKED on crates.io as of this PR.\n"
    },
    {
      "path": "services/loan/Cargo.lock",
      "content": "# This file is automatically @generated by Cargo.\n# It is not intended for manual editing.\nversion = 4\n\n[[package]]\nname    = \"tokio\"\nversion = \"1.35.0\"     # YANKED — implement stage's cargo_audit_summary.yanked_count = 1 confirms.\nsource  = \"registry+https://github.com/rust-lang/crates.io-index\"\n"
    }
  ],
  "tests_under_review": [
    {
      "path": "services/loan/Cargo.toml",
      "content": "# manifest review only — no Rust test code in this PR\n"
    }
  ],
  "idempotency_key": "13130000-7e6d-4f3a-bc44-aa11cc22dd33"
}
