{
  "design_document": "# Design — Cargo manifest hygiene\n\n## L1 invariant\n\n`Cargo.lock` is machine-managed. Legitimate diffs come only from `cargo update`, `cargo add`, `cargo remove`, or `cargo build` resolving a new manifest. Hand edits to `Cargo.lock` are forbidden. Every dependency-version change MUST be driven by a `Cargo.toml` change OR a documented `cargo update` invocation.\n\n## Public contract\n\nNo public-API impact for this PR — manifest-only.\n\n## Convention notes\n\n- `rust-version` (MSRV) MUST stay pinned in `Cargo.toml`.\n- Workspace `tokio` version is sourced from `[workspace.dependencies]`.\n- CI runs `cargo audit` against `Cargo.lock`.\n",
  "target_crate": "services/loan",
  "implement_stage_output": {
    "files_generated": [
      {"path": "services/loan/Cargo.lock", "lines": 8}
    ],
    "tests_generated": [
      {"path": "services/loan/Cargo.toml", "coverage_pct": 0, "kind": "manifest_review_only"}
    ],
    "idempotency_strategy": "naturally_idempotent_read_only",
    "compensating_actions": [],
    "audit_events_emitted": [],
    "uncertainty_flags": [],
    "decision_metadata": {
      "pattern_choices": ["bump_tokio_to_pick_up_security_patch"],
      "rust_specific": {
        "schema_version": "1.1-rust",
        "unsafe_declarations": [],
        "async_runtime_features": ["tokio_rt_multi_thread"],
        "clippy_lint_floor": "workspace.lints with unsafe_code=forbid"
      }
    }
  },
  "code_under_review": [
    {
      "path": "services/loan/Cargo.toml",
      "content": "[package]\nname         = \"loan\"\nversion      = \"0.4.2\"\nedition      = \"2021\"\nrust-version = \"1.74\"\n\n[dependencies]\ntokio = { version = \"1\", features = [\"rt-multi-thread\"] }\nuuid  = { version = \"1\", features = [\"v4\"] }\n# UNCHANGED: this manifest still pins tokio = \"1\". The Cargo.lock bump below has no manifest cause.\n"
    },
    {
      "path": "services/loan/Cargo.lock",
      "content": "# This file is automatically @generated by Cargo.\n# It is not intended for manual editing.\nversion = 4\n\n[[package]]\nname    = \"tokio\"\nversion = \"1.36.0\"     # BUG: hand-bumped from 1.35.0 with no `cargo update -p tokio` documented anywhere in the PR; Cargo.toml unchanged.\nsource  = \"registry+https://github.com/rust-lang/crates.io-index\"\nchecksum = \"abcd1234\"\n"
    }
  ],
  "tests_under_review": [
    {
      "path": "services/loan/Cargo.toml",
      "content": "# manifest review only — no Rust test code in this PR\n"
    }
  ],
  "idempotency_key": "99990000-7e6d-4f3a-bc44-aa11cc22dd33"
}
